{
  "$schema": "https://json-schema.org/draft/2020-12/schema",
  "$id": "https://atrinik.org/contracts/download.schema.json",
  "title": "Atrinik immutable download record",
  "type": "object",
  "additionalProperties": false,
  "required": [
    "releaseRepository",
    "artifactRole",
    "primary",
    "version",
    "artifactVersion",
    "releaseCoordinateException",
    "tag",
    "revision",
    "publishedAt",
    "verifiedAt",
    "draft",
    "prerelease",
    "immutable",
    "attested",
    "releaseAssets",
    "platform",
    "architecture",
    "archiveFormat",
    "artifact",
    "bytes",
    "sha256",
    "url",
    "releaseNotesUrl",
    "manifestUrl",
    "checksumsUrl",
    "sbomUrl",
    "softwareLicense",
    "bundledAssetsLicense",
    "compatibility",
    "installation"
  ],
  "properties": {
    "releaseRepository": {
      "type": "string",
      "pattern": "^atrinik/[a-z][a-z0-9-]*$"
    },
    "artifactRole": { "type": "string", "pattern": "^[a-z][a-z0-9-]*$" },
    "primary": { "type": "boolean" },
    "version": {
      "type": "string",
      "pattern": "^(0|[1-9][0-9]*)\\.(0|[1-9][0-9]*)\\.(0|[1-9][0-9]*)$"
    },
    "artifactVersion": {
      "type": "string",
      "pattern": "^(0|[1-9][0-9]*)\\.(0|[1-9][0-9]*)\\.(0|[1-9][0-9]*)$"
    },
    "releaseCoordinateException": {
      "enum": ["none", "authorized-artifact-version-mismatch"]
    },
    "tag": {
      "type": "string",
      "pattern": "^v(0|[1-9][0-9]*)\\.(0|[1-9][0-9]*)\\.(0|[1-9][0-9]*)$"
    },
    "revision": { "type": "string", "pattern": "^[0-9a-f]{40}$" },
    "publishedAt": {
      "type": "string",
      "format": "date-time",
      "pattern": "^(?:(?:\\d{2}(?:0[48]|[2468][048]|[13579][26])|(?:[02468][048]|[13579][26])00)-02-29|\\d{4}-(?:(?:0[13578]|1[02])-(?:0[1-9]|[12]\\d|3[01])|(?:0[469]|11)-(?:0[1-9]|[12]\\d|30)|02-(?:0[1-9]|1\\d|2[0-8])))T(?:[01]\\d|2[0-3]):[0-5]\\d:[0-5]\\dZ$"
    },
    "verifiedAt": {
      "type": "string",
      "format": "date-time",
      "pattern": "^(?:(?:\\d{2}(?:0[48]|[2468][048]|[13579][26])|(?:[02468][048]|[13579][26])00)-02-29|\\d{4}-(?:(?:0[13578]|1[02])-(?:0[1-9]|[12]\\d|3[01])|(?:0[469]|11)-(?:0[1-9]|[12]\\d|30)|02-(?:0[1-9]|1\\d|2[0-8])))T(?:[01]\\d|2[0-3]):[0-5]\\d:[0-5]\\dZ$"
    },
    "draft": { "const": false },
    "prerelease": { "const": false },
    "immutable": { "const": true },
    "attested": { "const": true },
    "releaseAssets": { "type": "integer", "minimum": 1, "maximum": 200 },
    "platform": { "enum": ["linux", "macos", "windows"] },
    "architecture": { "enum": ["x86_64"] },
    "archiveFormat": { "enum": ["tar.gz", "zip"] },
    "artifact": { "type": "string", "pattern": "^[A-Za-z0-9][A-Za-z0-9._-]+$" },
    "bytes": { "type": "integer", "minimum": 1, "maximum": 2147483648 },
    "sha256": { "type": "string", "pattern": "^[0-9a-f]{64}$" },
    "url": {
      "type": "string",
      "pattern": "^https://github\\.com/atrinik/[a-z0-9-]+/releases/download/v(0|[1-9][0-9]*)\\.(0|[1-9][0-9]*)\\.(0|[1-9][0-9]*)/[A-Za-z0-9._-]+$"
    },
    "releaseNotesUrl": {
      "type": "string",
      "pattern": "^https://github\\.com/atrinik/[a-z0-9-]+/releases/tag/v(0|[1-9][0-9]*)\\.(0|[1-9][0-9]*)\\.(0|[1-9][0-9]*)$"
    },
    "manifestUrl": {
      "type": "string",
      "pattern": "^https://github\\.com/atrinik/[a-z0-9-]+/releases/download/v(0|[1-9][0-9]*)\\.(0|[1-9][0-9]*)\\.(0|[1-9][0-9]*)/release-manifest\\.json$"
    },
    "checksumsUrl": {
      "type": "string",
      "pattern": "^https://github\\.com/atrinik/[a-z0-9-]+/releases/download/v(0|[1-9][0-9]*)\\.(0|[1-9][0-9]*)\\.(0|[1-9][0-9]*)/SHA256SUMS$"
    },
    "sbomUrl": {
      "type": "string",
      "pattern": "^https://github\\.com/atrinik/[a-z0-9-]+/releases/download/v(0|[1-9][0-9]*)\\.(0|[1-9][0-9]*)\\.(0|[1-9][0-9]*)/[A-Za-z0-9._-]+\\.spdx\\.json$"
    },
    "softwareLicense": { "enum": ["GPL-2.0-or-later", "MIT"] },
    "bundledAssetsLicense": {
      "type": "string",
      "minLength": 20,
      "maxLength": 300,
      "pattern": "^\\S(?:[\\s\\S]*\\S)?$"
    },
    "compatibility": {
      "type": "string",
      "minLength": 20,
      "maxLength": 300,
      "pattern": "^\\S(?:[\\s\\S]*\\S)?$"
    },
    "installation": {
      "type": "string",
      "minLength": 20,
      "maxLength": 500,
      "pattern": "^\\S(?:[\\s\\S]*\\S)?$"
    }
  },
  "allOf": [
    {
      "if": {
        "properties": { "primary": { "const": true } },
        "required": ["primary"]
      },
      "then": {
        "properties": {
          "releaseRepository": { "const": "atrinik/classic" },
          "artifactRole": { "const": "client" },
          "releaseAssets": { "const": 13 },
          "platform": { "const": "windows" },
          "architecture": { "const": "x86_64" },
          "archiveFormat": { "const": "zip" },
          "softwareLicense": { "const": "GPL-2.0-or-later" }
        }
      }
    },
    {
      "if": {
        "properties": { "archiveFormat": { "const": "zip" } },
        "required": ["archiveFormat"]
      },
      "then": { "properties": { "artifact": { "pattern": "\\.zip$" } } }
    },
    {
      "if": {
        "properties": { "archiveFormat": { "const": "tar.gz" } },
        "required": ["archiveFormat"]
      },
      "then": { "properties": { "artifact": { "pattern": "\\.tar\\.gz$" } } }
    }
  ]
}
