{
  "releaseRepository": "atrinik/classic",
  "artifactRole": "client",
  "primary": true,
  "version": "1.2.3",
  "artifactVersion": "1.2.3",
  "releaseCoordinateException": "none",
  "tag": "v1.2.3",
  "revision": "0123456789abcdef0123456789abcdef01234567",
  "publishedAt": "2026-01-02T03:04:05Z",
  "verifiedAt": "2026-01-03T03:04:05Z",
  "draft": false,
  "prerelease": false,
  "immutable": true,
  "attested": true,
  "releaseAssets": 13,
  "platform": "windows",
  "architecture": "x86_64",
  "archiveFormat": "zip",
  "artifact": "atrinik-classic-client-1.2.3-windows-x86_64.zip",
  "bytes": 123456,
  "sha256": "0123456789abcdef0123456789abcdef0123456789abcdef0123456789abcdef",
  "url": "https://github.com/atrinik/classic/releases/download/v1.2.3/atrinik-classic-client-1.2.3-windows-x86_64.zip",
  "releaseNotesUrl": "https://github.com/atrinik/classic/releases/tag/v1.2.3",
  "manifestUrl": "https://github.com/atrinik/classic/releases/download/v1.2.3/release-manifest.json",
  "checksumsUrl": "https://github.com/atrinik/classic/releases/download/v1.2.3/SHA256SUMS",
  "sbomUrl": "https://github.com/atrinik/classic/releases/download/v1.2.3/atrinik-classic-1.2.3.spdx.json",
  "softwareLicense": "GPL-2.0-or-later",
  "bundledAssetsLicense": "Bundled sound and authored assets retain their exact per-file terms.",
  "compatibility": "Atrinik Classic servers on the coordinated release line.",
  "installation": "Extract the portable archive, keep its directories together, and run the client executable."
}
